name,img,text
微了个博。,//pic.qiushibaike.com/system/avtnew/2370/23700137/thumb/20141212005836.jpg?imageView2/1/w/90/h/90,昨晚还跟我接吻，但是你们还是藕断丝连。糗友们，这种事很多吧。
小爷复姓欧阳诺一,//pic.qiushibaike.com/system/avtnew/2005/20053149/thumb/20190513165251.jpg?imageView2/1/w/90/h/90,他随着村里郎中学医，12岁时上山采药救了一只受伤的白狐。
。。。灰机啊,//pic.qiushibaike.com/system/avtnew/2052/20523443/thumb/20150717221634.jpg?imageView2/1/w/90/h/90,"记得有一次驾照考试，“科目三，我开着车教练坐在副驾驶""突然前面出来一个人...教练:“撞死他，我:谁?教练:前面那个人。我:好嘞!“至今也忘不了撞完以后教练看着我的眼神，迷茫中带着不解，惊讶中带着错愕""从那以后每到逢年过节，我都会去看守所跟他促膝长谈......"
球永乐,//pic.qiushibaike.com/system/avtnew/4225/42256441/thumb/20190614174051.jpg?imageView2/1/w/90/h/90,朋友说这两天犯了点事，多亏马云帮忙把他捞出来。原来是嫖娼被抓，罚款5000。手里没钱用花呗交的罚款[委屈]
哈和嗨,//pic.qiushibaike.com/system/avtnew/3052/30523052/thumb/20151026215115.jpg?imageView2/1/w/90/h/90,和领导去吃牛肉火锅。领导给我夹了一块大大的牛筋，说这个好吃。然后一直到买单我都还在嚼着那一块牛筋。
l280193359,//pic.qiushibaike.com/system/avtnew/449/4499898/thumb/20151209233159.jpg?imageView2/1/w/90/h/90,敌不动我不动，敌一动
依丽若水,//pic.qiushibaike.com/system/avtnew/3302/33028477/thumb/20190706111146.jpg?imageView2/1/w/90/h/90,小时候，我特别喜欢音乐，尤其是钢琴。
名剑977,//pic.qiushibaike.com/system/avtnew/626/6260922/thumb/20160609075834.jpg?imageView2/1/w/90/h/90,二闺女昨天晚上和老婆说希望明天上辅导班的时候希望她妈妈开电动车送她，因为她不想走路去。说着说着她就跟老婆说:如果不答应的话，就要断绝母女关系。
,,据媒体称警察查获一发廊有淫乱行为，下面是网友的跟帖
哈和嗨,//pic.qiushibaike.com/system/avtnew/3052/30523052/thumb/20151026215115.jpg?imageView2/1/w/90/h/90,本人吃饭喜欢抽烟。
没法过的日子,//pic.qiushibaike.com/system/avtnew/3072/30724710/thumb/20151203231851.jpg?imageView2/1/w/90/h/90,说个我堂哥的，去年年关我堂哥打工回来，我去到他家玩，刚好他妈那边的亲戚来了，我也没回家，吃过饭，都在聊天，我和堂哥在低头玩手机，我大伯就开始说我堂哥年纪不小了让说个老婆，他亲戚就问我堂哥喜欢啥样的。不知我堂哥那根筋搭错了，随口说了句，能用就行！...结果我大伯起来一巴掌给抽地上了！抽地上了！
简若^,//pic.qiushibaike.com/system/avtnew/2470/24703920/thumb/20190625153216.jpg?imageView2/1/w/90/h/90,前天表弟结婚，去接新娘子时，表弟忘记拿手捧花，赶紧跑回家拿，顺便去了趟厕所……
老巫婆～～,//pic.qiushibaike.com/system/avtnew/3424/34246786/thumb/20190626182935.jpg?imageView2/1/w/90/h/90,分手一年多的前任昨天突然打来电话，说他有了新的女朋友！
山鹰寂寞飞,//pic.qiushibaike.com/system/avtnew/2680/26800306/thumb/20171229230411.JPEG?imageView2/1/w/90/h/90,80年代，封闭落后的小农村，受着城市经济浪潮的冲击，渐渐有人开始在小农经济意识中觉醒。
劳资是小神龙,//pic.qiushibaike.com/system/avtnew/3585/35850250/thumb/20190613155745.jpg?imageView2/1/w/90/h/90,幼师一枚.....………………………………今天一位家长跑过来对我说，她儿子昨天尿裤子了。我问那为什么不告诉老师呢？她说，我也是这么问得，结果儿子说“嘘～别告诉老师，我马上就焐干了。”
『林夕』,//pic.qiushibaike.com/system/avtnew/1702/17022855/thumb/20160403065721.jpg?imageView2/1/w/90/h/90,病人嗓子疼。到医院后，医生说：你的扁桃腺发炎，最好把它切除。
